Sheet: Sheet1
B2: customerId | C2: date | D2: amount | F2: points earned
B3: 1 | C3: 2023-01-01T00:00:00.000 | D3: of:=RANDBETWEEN(10;200) -> 124 | F3: 98
B4: 1 | C4: 2023-01-02T00:00:00.000 | D4: of:=RANDBETWEEN(10;200) -> 176 | F4: 202
B5: 1 | C5: 2023-01-03T00:00:00.000 | D5: of:=RANDBETWEEN(10;200) -> 79 | F5: 29
B6: 1 | C6: 2023-01-04T00:00:00.000 | D6: of:=RANDBETWEEN(10;200) -> 175 | F6: 200
B7: 1 | C7: 2023-01-17T00:00:00.000 | D7: of:=RANDBETWEEN(10;200) -> 184 | F7: 218
B8: 1 | C8: 2023-01-18T00:00:00.000 | D8: of:=RANDBETWEEN(10;200) -> 187 | F8: 224
B9: 1 | C9: 2023-01-25T00:00:00.000 | D9: of:=RANDBETWEEN(10;200) -> 90 | F9: 40
B10: 1 | C10: 2023-01-26T00:00:00.000 | D10: of:=RANDBETWEEN(10;200) -> 119 | F10: 88
B11: 1 | C11: 2023-01-27T00:00:00.000 | D11: of:=RANDBETWEEN(10;200) -> 187 | F11: 224
B12: 1 | C12: 2023-01-28T00:00:00.000 | D12: of:=RANDBETWEEN(10;200) -> 195 | F12: 240
B13: 1 | C13: 2023-01-29T00:00:00.000 | D13: of:=RANDBETWEEN(10;200) -> 65 | F13: 15
B14: 1 | C14: 2023-02-07T00:00:00.000 | D14: of:=RANDBETWEEN(10;200) -> 41 | F14: 0
B15: 1 | C15: 2023-02-08T00:00:00.000 | D15: of:=RANDBETWEEN(10;200) -> 84 | F15: 34
B16: 1 | C16: 2023-02-09T00:00:00.000 | D16: of:=RANDBETWEEN(10;200) -> 59 | F16: 9
B17: 1 | C17: 2023-02-16T00:00:00.000 | D17: of:=RANDBETWEEN(10;200) -> 118 | F17: 86
B18: 1 | C18: 2023-02-17T00:00:00.000 | D18: of:=RANDBETWEEN(10;200) -> 80 | F18: 30
B19: 1 | C19: 2023-02-18T00:00:00.000 | D19: of:=RANDBETWEEN(10;200) -> 58 | F19: 8
B20: 1 | C20: 2023-02-25T00:00:00.000 | D20: of:=RANDBETWEEN(10;200) -> 163 | F20: 176
B21: 1 | C21: 2023-02-26T00:00:00.000 | D21: of:=RANDBETWEEN(10;200) -> 143 | F21: 136
B22: 1 | C22: 2023-02-27T00:00:00.000 | D22: of:=RANDBETWEEN(10;200) -> 119 | F22: 88
B23: 1 | C23: 2023-03-07T00:00:00.000 | D23: of:=RANDBETWEEN(10;200) -> 123 | F23: 96
B24: 1 | C24: 2023-03-08T00:00:00.000 | D24: of:=RANDBETWEEN(10;200) -> 120 | F24: 90
B25: 1 | C25: 2023-03-16T00:00:00.000 | D25: of:=RANDBETWEEN(10;200) -> 180 | F25: 210
B26: 1 | C26: 2023-03-17T00:00:00.000 | D26: of:=RANDBETWEEN(10;200) -> 19 | F26: 0
B27: 1 | C27: 2023-03-18T00:00:00.000 | D27: of:=RANDBETWEEN(10;200) -> 145 | F27: 140
B28: 1 | C28: 2023-03-19T00:00:00.000 | D28: of:=RANDBETWEEN(10;200) -> 80 | F28: 30
B29: 1 | C29: 2023-03-20T00:00:00.000 | D29: of:=RANDBETWEEN(10;200) -> 74 | F29: 24
B30: 2 | C30: 2023-01-04T00:00:00.000 | D30: of:=RANDBETWEEN(10;200) -> 65 | F30: 15
B31: 2 | C31: 2023-01-05T00:00:00.000 | D31: of:=RANDBETWEEN(10;200) -> 21 | F31: 0
B32: 2 | C32: 2023-01-06T00:00:00.000 | D32: of:=RANDBETWEEN(10;200) -> 177 | F32: 204
B33: 2 | C33: 2023-01-17T00:00:00.000 | D33: of:=RANDBETWEEN(10;200) -> 142 | F33: 134
B34: 2 | C34: 2023-01-18T00:00:00.000 | D34: of:=RANDBETWEEN(10;200) -> 158 | F34: 166
B35: 2 | C35: 2023-01-19T00:00:00.000 | D35: of:=RANDBETWEEN(10;200) -> 194 | F35: 238
B36: 2 | C36: 2023-01-20T00:00:00.000 | D36: of:=RANDBETWEEN(10;200) -> 180 | F36: 210
B37: 2 | C37: 2023-01-28T00:00:00.000 | D37: of:=RANDBETWEEN(10;200) -> 193 | F37: 236
B38: 2 | C38: 2023-01-29T00:00:00.000 | D38: of:=RANDBETWEEN(10;200) -> 112 | F38: 74
B39: 2 | C39: 2023-01-30T00:00:00.000 | D39: of:=RANDBETWEEN(10;200) -> 184 | F39: 218
B40: 2 | C40: 2023-01-31T00:00:00.000 | D40: of:=RANDBETWEEN(10;200) -> 49 | F40: 0
B41: 2 | C41: 2023-02-07T00:00:00.000 | D41: of:=RANDBETWEEN(10;200) -> 170 | F41: 190
B42: 2 | C42: 2023-02-08T00:00:00.000 | D42: of:=RANDBETWEEN(10;200) -> 113 | F42: 76
B43: 2 | C43: 2023-02-09T00:00:00.000 | D43: of:=RANDBETWEEN(10;200) -> 188 | F43: 226
B44: 2 | C44: 2023-02-10T00:00:00.000 | D44: of:=RANDBETWEEN(10;200) -> 146 | F44: 142
B45: 2 | C45: 2023-02-17T00:00:00.000 | D45: of:=RANDBETWEEN(10;200) -> 95 | F45: 45
B46: 2 | C46: 2023-02-18T00:00:00.000 | D46: of:=RANDBETWEEN(10;200) -> 63 | F46: 13
B47: 2 | C47: 2023-02-19T00:00:00.000 | D47: of:=RANDBETWEEN(10;200) -> 40 | F47: 0
B48: 2 | C48: 2023-02-20T00:00:00.000 | D48: of:=RANDBETWEEN(10;200) -> 136 | F48: 122
B49: 2 | C49: 2023-02-28T00:00:00.000 | D49: of:=RANDBETWEEN(10;200) -> 124 | F49: 98
B50: 2 | C50: 2023-03-01T00:00:00.000 | D50: of:=RANDBETWEEN(10;200) -> 81 | F50: 31
B51: 2 | C51: 2023-03-02T00:00:00.000 | D51: of:=RANDBETWEEN(10;200) -> 129 | F51: 108
B52: 2 | C52: 2023-03-03T00:00:00.000 | D52: of:=RANDBETWEEN(10;200) -> 116 | F52: 82
B53: 2 | C53: 2023-03-04T00:00:00.000 | D53: of:=RANDBETWEEN(10;200) -> 61 | F53: 11
B54: 2 | C54: 2023-03-12T00:00:00.000 | D54: of:=RANDBETWEEN(10;200) -> 21 | F54: 0
B55: 2 | C55: 2023-03-13T00:00:00.000 | D55: of:=RANDBETWEEN(10;200) -> 75 | F55: 25
B56: 2 | C56: 2023-03-14T00:00:00.000 | D56: of:=RANDBETWEEN(10;200) -> 38 | F56: 0
B57: 2 | C57: 2023-03-21T00:00:00.000 | D57: of:=RANDBETWEEN(10;200) -> 87 | F57: 37
B58: 2 | C58: 2023-03-22T00:00:00.000 | D58: of:=RANDBETWEEN(10;200) -> 107 | F58: 64
B59: 2 | C59: 2023-03-23T00:00:00.000 | D59: of:=RANDBETWEEN(10;200) -> 51 | F59: 1